,cluster,keywords,repre_news,rep_news,news_links,news_titles
0,0,"benedict, death, charge, student, college, strain","36,25,100,102","{'100', '25', '102', '36'}","https://abcnews.go.com/US/new-video-shows-missing-student-riley-strain-briefly/story?id=108242090, https://abcnews.go.com/US/missing-university-missouri-student-riley-strains-bank-card/story?id=108216437, https://www.npr.org/2024/03/21/1240079971/nex-benedict-case-tulsa-da, https://abcnews.go.com/US/nex-benedict-fight-no-charges/story?id=108368542",New video shows college student briefly speak with police on night he vanished; Missing University of Missouri student Riley Strain's bank card discovered as search continues; Oklahoma prosecutors will not press charges in Nex Benedict case; No charges to be filed in school fight involving Nex Benedict: DA
1,1,"eurovision, boycott, growth, gaza, israel, song","192,172,274,21","{'172', '192', '274', '21'}","https://www.forbes.com/sites/jamesfarrell/2024/03/29/nine-eurovision-acts-call-for-israel-hamas-cease-fire-but-will-stop-short-of-boycott/, https://finance.yahoo.com/news/grindr-gets-first-buy-rating-155302401.html, https://www.npr.org/2024/04/05/1242991224/up-first-newsletter-biden-netanyahu-us-policy-no-labels-2024-election, https://www.rt.com/news/594359-orban-hungary-eu-occupy/",Nine Eurovision Acts Call For Israel-Hamas Cease-Fire—But Will Stop Short Of Boycott; Grindr Gets First Buy Rating as Cowen Sees Growth Outpacing Tinder Owner; Biden warns Netanyahu about the U.S.' Gaza policy No Labels backs out of 2024 race; Hungary’s PM urges supporters to ‘occupy Brussels’
2,2,"bill, anti, state, book, report, school","152,151,324,122","{'151', '152', '324', '122'}","https://www.cbc.ca/news/world/thailand-marriage-equality-bill-1.7156766, https://www.nbcnews.com/nbc-out/out-news/thailand-same-sex-marriage-bill-passes-parliament-rcna145239, https://www.naturalnews.com/2024-04-11-lgbtq-theme-books-most-challenged-library-books-2023.html, https://www.abc.net.au/news/2024-03-25/federal-parliament-live-updates-march-25/103626402",Marriage equality bill overwhelmingly passes Thai lower house; Thailand moves closer to legalizing same-sex marriage as parliament passes landmark bill; LGBTQ-themed books top list of most challenged library books of 2023; Live: New report finds discrimination endemic in religious schools as government considers legislation
3,3,"star, film, transgender, glaad, love","22,20,366,7","{'7', '20', '366', '22'}","https://www.breitbart.com/entertainment/2024/03/17/elliot-page-lgbtqqiaap2s-themed-films-are-not-niche-because-30-of-youth-identify-as-lgbtqqiaap2s/, https://www.advocate.com/arts-entertainment/anyone-but-you-lesbian-wedding, https://www.breitbart.com/entertainment/2024/04/13/watch-dr-phil-audience-laughs-after-trans-activist-says-3-year-olds-know-who-they-are/, https://www.advocate.com/media/oprah-niecy-out-glaad-awards","Elliot Page: LGBTQQIAAP2S+-Themed Films Are Not 'Niche' Because 30% of Youth Identify as LGBTQQIAAP2S+; Check out the lesbian wedding at the center of 'Anyone But You'; Watch: 'Dr. Phil' Audience Laughs After Trans Activist Says 3 Year Olds 'Know Who They Are'; Oprah, Niecy Nash, Out win big at GLAAD awards"
4,4,"trump, year, donald, host, health, face","63,177,230,83","{'230', '177', '83', '63'}","https://www.advocate.com/education/travis-akers-duval-school-board, https://www.advocate.com/news/will-wooten-donald-trump-trial, https://www.naturalnews.com/2024-04-01-bezos-ex-wife-donations-migrant-invasion-transgenderism.html, https://www.nbcnews.com/nbc-out/out-news/lgbtq-nonprofits-mackenzie-scott-billionaire-amazon-rcna144245","Navy vet opposes Moms for Liberty-backed homeschool advocate for Florida school board seat; Meet Will Wooten, the gay lawyer on the team prosecuting Donald Trump in Georgia; Jeff Bezos’ ex-wife handing majority of $640M donation war chest to leftist groups pushing illegal migrant invasion, transgenderism; Over a dozen LGBTQ nonprofits among recipients of billionaire MacKenzie Scott’s latest donations"
5,5,"transgender, city, sanctuary, identify, lesbian, orgasm","154,156,329,34","{'156', '154', '34', '329'}","https://www.nbcnews.com/nbc-out/out-news/sacramento-sanctuary-city-transgender-people-rcna145287, https://www.cbsnews.com/sacramento/news/sanctuary-city-transgenders-sacramento/, https://www.advocate.com/news/lesbians-straight-women-orgasms, https://www.naturalnews.com/2024-03-18-american-adults-identifying-lgbtq-more-than-doubled.html","Sacramento declares itself a sanctuary city for transgender people; Sacramento is now a sanctuary city for transgender people; Lesbians have more orgasms than straight women — and yes, it's men's fault; Gallup poll: The number of American adults identifying as LGBTQ+ has more than doubled in the last 12 years"
6,6,"transgender, sport, athlete, court, ncaa, lawsuit","235,234,81,160","{'234', '160', '81', '235'}","https://www.cbsnews.com/minnesota/news/wisconsin-governor-veto-transgender-high-school-athletics-ban-lgbtq-rights/, https://www.advocate.com/politics/wisconsin-trans-sports-ban-veto, https://www.advocate.com/news/nicole-berner-lesbian-judge-confirmed, https://www.cbc.ca/news/world/disney-desantis-lawsuit-settled-1.7157648","Wisconsin Gov. Evers vetoes transgender high school athletics ban, decries ""radical policies targeting LGBTQ""; Wisconsin’s Democratic governor vetoes Republican transgender sports ban bill; Lesbian lawyer Nicole Berner confirmed as federal appeals court judge; DeSantis and Disney settle lawsuit sparked by Florida governor's 'Don't Say Gay' law"
7,7,"gender, vatican, surrogacy, change, james","296,299,50,358","{'50', '299', '358', '296'}","https://www.nbcnews.com/news/world/vatican-blasts-gender-affirming-surgery-surrogacy-gender-theory-rcna146824, https://www.forbes.com/sites/roberthart/2024/04/08/vatican-condemns-gender-affirming-surgery-gender-theory-and-surrogacy-as-threats-to-human-dignity/, https://www.naturalnews.com/2024-03-18-spanish-corporal-self-declared-gender-change-pay-increase.html, https://www.nbcnews.com/nbc-out/out-news/surrogate-parenthood-inhuman-italys-meloni-says-rcna147581","Vatican blasts gender-affirming surgery, surrogacy and gender theory as violations of human dignity; Vatican Condemns Gender-Affirming Surgery, Gender Theory And Surrogacy As Threats To Human ‘Dignity’; Bearded Spanish Army corporal “equipped with male organs” legally changes gender identity to unlock better military pay package, private rooms; Surrogate parenthood is 'inhuman', Italy's Giorgia Meloni says"
8,8,"russia, anti, face, arrest, trans, tran","166,252,260,289","{'252', '260', '166', '289'}","https://www.forbes.com/sites/ashleemariepreston/2024/03/28/glaads-new-report-on-anti-trans-hate-demands-action-from-meta/, https://www.advocate.com/news/chaya-raichik-doubletree-california, https://www.breitbart.com/social-justice/2024/04/04/north-face-among-sponsors-of-lgbtq-camp-where-12-year-olds-can-perform-in-drag/, https://www.naturalnews.com/2024-04-08-north-face-target-lgbt-youth-camp-genderless.html","GLAAD’s New Report On Anti-Trans Hate Demands Action From Meta; Human Rights Campaign expects Hilton to cancel California event featuring Libs of TikTok creator; North Face Among Sponsors of LGBTQ Camp Where 12-Year-Olds Can Perform in Drag; The North Face, Target now funding LGBT youth camp teaching children to be “genderless” drag stars"
9,9,"transgender, visibility, biden, trump, president","210,216,262,317","{'262', '317', '210', '216'}","https://www.breitbart.com/politics/2024/03/30/joe-biden-declares-easter-sunday-transgender-day-of-visibility/, https://www.breitbart.com/politics/2024/03/30/florida-gop-blasts-biden-declaring-easter-sunday-transgender-day-visibility/, https://www.advocate.com/politics/lara-trump-biden-transgender-events, https://www.advocate.com/news/out-for-biden-harris-launch",Joe Biden Declares Easter Sunday 'Transgender Day of Visibility'; Florida GOP Blasts Biden for Declaring Easter Sunday 'Transgender Day of Visibility'; Lara Trump awkwardly blames Biden’s support of trans people for high gas prices and Israel-Hamas war; Joe Biden launches ‘Out for Biden-Harris’ campaign initiative to engage & woo LGBTQ+ voters (exclusive)
