,title,news_id,text,cluster,processed_text,keywords,repre_news
6,Missing college student's stepdad opens up about family's difficult conversations,90,Missing college student's stepdad opens up about family's difficult conversations. The stepfather of missing college student Riley Strain opened up to ABC News about the excruciating search for his son.,0,miss college student stepdad open family difficult conversation stepfather miss college student riley strain open abc news excruciate search son,"student, death, benedict, nex, charge","36,90,102,100"
164,What is the religious discrimination debate about?,91,"What is the religious discrimination debate about?. The debate over LGBT staff and students in religious schools is back this week. We don't have a specific proposal, but what do we know?",2,religious discrimination debate debate staff student religious school week specific proposal know,"bill, anti, ban, marriage, new, law","251,167,152,151"
277,Gay bar managers arrested in Russian city,92,Gay bar managers arrested in Russian city. Two gay bar employees have been arrested on “LGBT propaganda” charges in Russia Read Full Article at RT.com,8,bar manager arrest russian city bar employee arrest propaganda charge russia rt.com,"russia, right, face, hate, man, new","260,101,44,252"
165,Out Congress members outraged as anti-LGBTQ+ bills advance,93,"Out Congress members outraged as anti-LGBTQ+ bills advance. Committees in the U.S. House of Representatives approved two anti-LGBTQ+ bills Thursday, leading to condemnation from LGBTQ+ reps and allies in the Congressional Equality Caucus.",2,congress member outrage anti lgbtq+ bill advance committee u.s. house representatives approve anti lgbtq+ bill thursday lead condemnation lgbtq+ rep ally congressional equality caucus,"bill, anti, ban, marriage, new, law","251,167,152,151"
166,Cable news coverage of 2023 anti-trans bills lacked trans voices: Media Matters,94,"Cable news coverage of 2023 anti-trans bills lacked trans voices: Media Matters. Cable news outlets couldn’t avoid covering the rash of anti-transgender bills in state legislatures in 2023, but they didn’t often feature trans people talking about the subject, according to new research from Media Matters for America.",2,cable news coverage 2023 anti trans bill lack tran voice media matters cable news outlet avoid cover rash anti transgender bill state legislature 2023 feature tran talk subject accord new research media matters america,"bill, anti, ban, marriage, new, law","251,167,152,151"
167,Ghana cabinet nominees blocked in anti-gay bill row,95,"Ghana cabinet nominees blocked in anti-gay bill row. The president is under pressure from Ghanaians who want him to sign the bill, and from those who condemn it.",2,ghana cabinet nominee block anti bill row president pressure ghanaians want sign bill condemn,"bill, anti, ban, marriage, new, law","251,167,152,151"
129,Ramadan is about 'gratitude and spirituality.' Here's how 2 groups are giving back,96,"Ramadan is about 'gratitude and spirituality.' Here's how 2 groups are giving back. This Ramadan, a new group for people who identify as queer and Muslim is showing their love for the Hamilton community through food. Meanwhile, another group, Mishka Social Services, is raising money to support refugees from Gaza.",5,ramadan gratitude spirituality 2 group ramadan new group identify muslim love hamilton community food group mishka social services raise money support refugee gaza,"community, sanctuary, city, transgender, group","229,34,154,175"
168,Georgian MP introduces bill that seeks to ban LGBT propaganda and indoctrination efforts (most of which target youth),97,"Georgian MP introduces bill that seeks to ban LGBT propaganda and indoctrination efforts (most of which target youth). Mamuka Mdinaradze, majority leader of Georgia’s unicameral parliament, has introduced a bill that seeks to ban LGBT propaganda in the country. The bill aims to protect the society from pseudo-liberal ideology and its inevitable harmful consequences. “Georgian…",2,georgian mp introduce bill seek ban propaganda indoctrination effort target youth mamuka mdinaradze majority leader georgia unicameral parliament introduce bill seek ban propaganda country bill aim protect society pseudo liberal ideology inevitable harmful consequence georgian …,"bill, anti, ban, marriage, new, law","251,167,152,151"
169,'We will protect you': NSW bans gay conversion therapy after marathon parliamentary debate,98,"'We will protect you': NSW bans gay conversion therapy after marathon parliamentary debate. Advocacy group Equality Australia calls the move a ""historic step"", paying tribute to trailblazing 78ers who took to the streets in protest to make change for the LGBTQ+ community.",2,protect nsw ban conversion therapy marathon parliamentary debate advocacy group equality australia historic step pay tribute trailblaze 78er street protest change lgbtq+ community,"bill, anti, ban, marriage, new, law","251,167,152,151"
170,"Government hears back on religious schools review, but its own plans are still unclear",99,"Government hears back on religious schools review, but its own plans are still unclear. An independent review into protecting LGBT staff and students at religious schools is now complete, but the government's own plans are no clearer.",2,government hear religious school review plan unclear independent review protect staff student religious school complete government plan clear,"bill, anti, ban, marriage, new, law","251,167,152,151"
7,Oklahoma prosecutors will not press charges in Nex Benedict case,100,"Oklahoma prosecutors will not press charges in Nex Benedict case. Nex, a nonbinary teen, died by suicide after a high school fight. The Tulsa County District Attorney says the fight was mutual and there's not enough evidence to press charges.",0,oklahoma prosecutor press charge nex benedict case nex nonbinary teen die suicide high school fight tulsa county district attorney fight mutual evidence press charge,"student, death, benedict, nex, charge","36,90,102,100"
278,Moscow adds 'LGBT movement' to list of extremist and terrorist organizations...,101,"Moscow adds 'LGBT movement' to list of extremist and terrorist organizations.... Moscow adds 'LGBT movement' to list of extremist and terrorist organizations...

 
 
 
 (Third column, 6th story, link)

 

 

 
 Related stories:Record Russian Missile Barrage Disrupts Ukraine Power System...
Crackdown on Artists Paints Portrait of Scar…",8,moscow add movement list extremist terrorist organization .... moscow add movement list extremist terrorist organization ... column 6th story link relate story record russian missile barrage disrupts ukraine power system ... crackdown artists paint portrait scar …,"russia, right, face, hate, man, new","260,101,44,252"
8,No charges to be filed in school fight involving Nex Benedict: DA,102,"No charges to be filed in school fight involving Nex Benedict: DA. No charges will be filed in connection with a fight that Oklahoma teen Nex Benedict was involved in a day before they died, the Tulsa County district attorney said.",0,charge file school fight involve nex benedict da charge file connection fight oklahoma teen nex benedict involve day die tulsa county district attorney,"student, death, benedict, nex, charge","36,90,102,100"
171,US to ban LGBTQ flags from embassies – Bloomberg,103,"US to ban LGBTQ flags from embassies – Bloomberg. American embassies won’t be able to fly the rainbow banner until October 1, as part of a $1.2 trillion spending deal Read Full Article at RT.com",2,ban flag embassy – bloomberg american embassy able fly rainbow banner october 1 1.2 trillion spending deal rt.com,"bill, anti, ban, marriage, new, law","251,167,152,151"
172,Tennessee bill would permit anti-LGBTQ+ foster and adoptee parents,104,"Tennessee bill would permit anti-LGBTQ+ foster and adoptee parents. The Tennessee state Senate on Tuesday passed legislation that would bar the state from excluding foster and adopting parents because of their religious or moral beliefs, including on matters of sexual and gender identity.",2,tennessee bill permit anti lgbtq+ foster adoptee parent tennessee state senate tuesday pass legislation bar state exclude foster adopt parent religious moral belief include matter sexual gender identity,"bill, anti, ban, marriage, new, law","251,167,152,151"
173,White House Agrees To Ban Pride Flags At US Embassies In Spending Bill Deal,105,"White House Agrees To Ban Pride Flags At US Embassies In Spending Bill Deal. The State Department authorized pride flags to be flown at U.S. embassies in 2021, reversing a Trump-era ban.",2,white house agree ban pride flags embassies spending bill deal state department authorize pride flag fly u.s. embassy 2021 reverse trump era ban,"bill, anti, ban, marriage, new, law","251,167,152,151"
279,‘LGBT movement’ added to Russia’s terrorist list,106,‘LGBT movement’ added to Russia’s terrorist list. The Russian Federal Financial Monitoring Service’s website was updated on Friday to include the LGBT movement Read Full Article at RT.com,8,movement add russia terrorist list russian federal financial monitoring service website update friday include movement rt.com,"russia, right, face, hate, man, new","260,101,44,252"
87,"Drag story hour at library canceled after suspicious package and threats, authorities say",107,"Drag story hour at library canceled after suspicious package and threats, authorities say. A suspicious package was found in the library.",4,drag story hour library cancel suspicious package threat authority suspicious package find library,"trump, new, republican, face, drag, health","230,83,59,63"
280,LGBT Community Melts Down After Biological Male Voice Actor Accuses Game Developer of 'Transphobia',108,"LGBT Community Melts Down After Biological Male Voice Actor Accuses Game Developer of 'Transphobia'. Behaviour Interactive, the developers behind the popular online survival horror game Dead By Daylight, have found themselves facing controversy after the recent addition of a new character sparked allegations of transphobia from the character's transgender vo…",8,community melts biological male voice actor accuses game developer transphobia behaviour interactive developer popular online survival horror game dead daylight find face controversy recent addition new character spark allegation transphobia character transgender vo …,"russia, right, face, hate, man, new","260,101,44,252"
230,"Years after her death, a trailblazing transgender P.E.I. artist will be part of prestigious Venice show",109,"Years after her death, a trailblazing transgender P.E.I. artist will be part of prestigious Venice show. Erica Rutherford, a groundbreaking transgender painter, filmmaker and writer, is the first Prince Edward Island artist to ever be selected for the prestigious Venice Biennale art show.",3,year death trailblaze transgender p.e.i. artist prestigious venice erica rutherford groundbreaking transgender painter filmmaker writer prince edward island artist select prestigious venice biennale art,"new, star, film, actor, audience, love","7,20,366,22"
174,New government spending bill bans U.S. embassies from flying Pride flag,110,New government spending bill bans U.S. embassies from flying Pride flag. The prohibition was one of many side issues included in the mammoth $1.2 trillion package to fund the government through September.,2,new government spending bill ban u.s. embassy fly pride flag prohibition issue include mammoth 1.2 trillion package fund government september,"bill, anti, ban, marriage, new, law","251,167,152,151"
88,"Evacuation Orders Lifted After Series Of Bomb Threats Target Lancaster, Pennsylvania",111,"Evacuation Orders Lifted After Series Of Bomb Threats Target Lancaster, Pennsylvania. The city’s public library was apparently targeted for hosting a “Drag Queen Story Hour.”",4,evacuation orders lift series bomb threats target lancaster pennsylvania city public library apparently target host drag queen story hour,"trump, new, republican, face, drag, health","230,83,59,63"
231,Fawzia Mirza's The Queen of My Dreams is a love letter to Bollywood and queerness,112,"Fawzia Mirza's The Queen of My Dreams is a love letter to Bollywood and queerness. The film tells the story of a mother, Mariam, played by Nimra Bucha, and her daughter, Azra, coming of age while exploring the two characters' complicated relationships to their home countries and each other.",3,fawzia mirza queen dreams love letter bollywood queerness film tell story mother mariam play nimra bucha daughter azra come age explore character complicated relationship home country,"new, star, film, actor, audience, love","7,20,366,22"
89,Biden Signs $1.2 Trillion Spending Bill—Ending Repeated Government Shutdown Concerns After Months Of Negotiations,113,Biden Signs $1.2 Trillion Spending Bill—Ending Repeated Government Shutdown Concerns After Months Of Negotiations. The Senate approved the spending package early Saturday to avoid a partial government shutdown.,4,biden sign 1.2 trillion spending bill — end repeated government shutdown concerns month negotiation senate approve spending package early saturday avoid partial government shutdown,"trump, new, republican, face, drag, health","230,83,59,63"
90,Ricky Martin reflects on his decision to come out publicly as gay,114,"Ricky Martin reflects on his decision to come out publicly as gay. Ricky Martin said his father, a psychologist, was one of the people who encouraged him to come out publicly as gay.",4,ricky martin reflect decision come publicly ricky martin father psychologist encourage come publicly,"trump, new, republican, face, drag, health","230,83,59,63"
175,Bipartisan spending bill includes effective ban on Pride flags over U.S. embassies,115,Bipartisan spending bill includes effective ban on Pride flags over U.S. embassies. A ban on U.S. embassies flying LGBTQ Pride flags is part of a bipartisan funding deal to avoid a government shutdown ahead of a weekend deadline.,2,bipartisan spending bill include effective ban pride flag u.s. embassy ban u.s. embassy fly pride flag bipartisan funding deal avoid government shutdown ahead weekend deadline,"bill, anti, ban, marriage, new, law","251,167,152,151"
281,"In latest move, Russia adds ‘LGBT movement’ to official list of extremists and terrorists",116,"In latest move, Russia adds ‘LGBT movement’ to official list of extremists and terrorists. Russia has added what it calls the “LGBT movement” to a list of extremist and terrorist organizations, state media said on Friday.",8,late russia add movement official list extremist terrorist russia add movement list extremist terrorist organization state medium friday,"russia, right, face, hate, man, new","260,101,44,252"
282,Russia adds 'LGBT movement' to list of extremist groups,117,Russia adds 'LGBT movement' to list of extremist groups. A Russian monitor with the power to freeze bank accounts has designated what it calls the LGBT movement an extremist organization. It comes after a similar ruling from the Supreme Court last November.,8,russia add movement list extremist group russian monitor power freeze bank account designate movement extremist organization come similar ruling supreme court november,"russia, right, face, hate, man, new","260,101,44,252"
283,Final resting place of queer bushranger pair in line for heritage recognition,118,"Final resting place of queer bushranger pair in line for heritage recognition. The graves of Captain Moonlite and James Nesbitt are being considered for the state heritage register, not only for their notoriety as colonial-era criminals, but for their publicly acknowledged same-sex relationship.",8,final rest place bushranger pair line heritage recognition grave captain moonlite james nesbitt consider state heritage register notoriety colonial era criminal publicly acknowledge sex relationship,"russia, right, face, hate, man, new","260,101,44,252"
9,"No charges filed in Nex Benedict's death, Oklahoma district attorney says",119,"No charges filed in Nex Benedict's death, Oklahoma district attorney says. Nex Benedict's death prompted rallies and vigils in U.S. cities from New York to Los Angeles.",0,charge file nex benedict death oklahoma district attorney nex benedict death prompt rally vigil u.s. city new york los angeles,"student, death, benedict, nex, charge","36,90,102,100"
176,How Two Recent Cases Of Violence Illustrate The Lives of LGBTQ People,120,"How Two Recent Cases Of Violence Illustrate The Lives of LGBTQ People. Suicide rates for queer and trans people are disproportionately high. They're also routinely targets of violence and hate crimes.<br/><br/>While some states have protections for queer and trans people, many other states have passed laws that restrict the righ…",2,recent case violence illustrate life suicide rate tran disproportionately high routinely target violence hate crimes.<br/><br/>while state protection trans state pass law restrict righ …,"bill, anti, ban, marriage, new, law","251,167,152,151"
177,"Embassies Banned From Flying LGBTQ Pride Flags, House DEI Office Closed By Spending Bill",121,"Embassies Banned From Flying LGBTQ Pride Flags, House DEI Office Closed By Spending Bill. One of the provisions included in the recently passed government funding bill banned the pride flag from being displayed at U.S embassies.",2,embassy ban flying pride flags house dei office closed spending bill provision include recently pass government funding bill ban pride flag display u.s embassy,"bill, anti, ban, marriage, new, law","251,167,152,151"
178,Live: New report finds discrimination endemic in religious schools as government considers legislation,122,"Live: New report finds discrimination endemic in religious schools as government considers legislation. An Equality Australia report says students in religious schools are more likely to be discriminated against, as the federal government considers new laws on the subject.",2,live new report find discrimination endemic religious school government consider legislation equality australia report student religious school likely discriminate federal government consider new law subject,"bill, anti, ban, marriage, new, law","251,167,152,151"
37,"Women Don’t Need To Be Fixed, Organizations Need To Fix Their Systems",123,"Women Don’t Need To Be Fixed, Organizations Need To Fix Their Systems. Instead of encouraging women to be more like men, we need organizations to meet women where they are and build a culture that values gender equality.",6,need fix organization need fix systems instead encourage like man need organization meet build culture value gender equality,"transgender, sport, athlete, court, ban","239,235,81,331"
284,Transgender teen sent to prison for killing 12-year-old girl,124,Transgender teen sent to prison for killing 12-year-old girl. A trans teen is sentenced after confessing to shooting his underage girlfriend while on a movie date Read Full Article at RT.com,8,transgender teen send prison kill 12 year old girl tran teen sentence confess shoot underage girlfriend movie date rt.com,"russia, right, face, hate, man, new","260,101,44,252"
285,Two recent case of violence showcase the realities LGBTQ people face,125,Two recent case of violence showcase the realities LGBTQ people face. NPR's Scott Detrow speaks with Kris Tassone from the National Center For Transgender Equality about how two recent cases of violence against trans people illustrate the realities LGBTQ people face.,8,recent case violence showcase reality face npr scott detrow speak kris tassone national center transgender equality recent case violence trans illustrate reality face,"russia, right, face, hate, man, new","260,101,44,252"
38,Black Athletes Could Upset March Madness And End Attacks On DEI,126,"Black Athletes Could Upset March Madness And End Attacks On DEI. Many Black athletes in the 2024 NCAA basketball tournaments attend universities in states where diversity, equity, and inclusion initiatives are under legislative attack.",6,black athletes upset march madness end attack dei black athlete 2024 ncaa basketball tournament attend university state diversity equity inclusion initiative legislative attack,"transgender, sport, athlete, court, ban","239,235,81,331"
91,"Christian Cooper, the ""Extraordinary Birder""",127,"Christian Cooper, the ""Extraordinary Birder"". Christian Cooper made national news in May 2020 when, while birdwatching in New York's Central Park, a white woman called 911 to report that an ""African American man was threatening her life"" after he'd asked her to put her dog on a leash. His recording of th…",4,christian cooper extraordinary birder christian cooper national news 2020 birdwatch new york central park white 911 report african american man threaten life ask dog leash recording th …,"trump, new, republican, face, drag, health","230,83,59,63"
232,Pilgrimage helped Traitors' star Amanda say 'goodbye mum',128,Pilgrimage helped Traitors' star Amanda say 'goodbye mum'. The star of the first series of BBC show on the celebrity walk that helped her deal with her grief.,3,pilgrimage help traitor star amanda goodbye mum star series bbc celebrity walk help deal grief,"new, star, film, actor, audience, love","7,20,366,22"
317,Dragon Ball theme park to be built in Saudi Arabia,129,Dragon Ball theme park to be built in Saudi Arabia. The announcement was met with mixed reactions from fans of the famed anime.,1,dragon ball theme park build saudi arabia announcement meet mixed reaction fan famed anime,"eurovision, boycott, growth, gaza, israel, song","192,172,274,21"
179,"Amid book bans, DEI cuts and 'Don't Say Gay' laws, 7 states will mandate LGBTQ-inclusive curricula",130,"Amid book bans, DEI cuts and 'Don't Say Gay' laws, 7 states will mandate LGBTQ-inclusive curricula. Washington will now mandate that the state’s public schools teach LGBTQ history, as red and blue states continue to diverge on whether schools should expose kids to gay and trans identities.",2,amid book ban dei cut law 7 state mandate inclusive curriculum washington mandate state public school teach history red blue state continue diverge school expose kid trans identity,"bill, anti, ban, marriage, new, law","251,167,152,151"
92,Judge dismisses suit by Musk's X against nonprofit researchers tracking hate speech,131,"Judge dismisses suit by Musk's X against nonprofit researchers tracking hate speech. A federal judge has dismissed a lawsuit by Elon Musk’s X Corp. against the non-profit Center for Countering Digital Hate, which has documented the increase in hate speech on the site since it was purchased by the Tesla owner",4,judge dismiss suit musk x nonprofit researcher track hate speech federal judge dismiss lawsuit elon musk x corp. non profit center counter digital hate document increase hate speech site purchase tesla owner,"trump, new, republican, face, drag, health","230,83,59,63"
39,"'Damned if you do, damned if you don't' - sportswomen on trans debate",132,"'Damned if you do, damned if you don't' - sportswomen on trans debate. More than 100 elite British sportswomen tell the BBC they would be uncomfortable with transgender women competing in female categories in their sport.",6,damned damn sportswomen trans debate 100 elite british sportswoman tell bbc uncomfortable transgender compete female category sport,"transgender, sport, athlete, court, ban","239,235,81,331"
10,What to know about the Moscow concert attack and what's next in the case,133,"What to know about the Moscow concert attack and what's next in the case. Russia is still reeling from Friday's attack. Authorities have confirmed at least 137 dead. Suspects, some showing signs of torture, have been charged. Here are other key developments.",0,know moscow concert attack case russia reel friday attack authority confirm 137 dead suspect sign torture charge key development,"student, death, benedict, nex, charge","36,90,102,100"
180,Georgian lawmaker urges UN not to confuse the rights of minorities with the harmful consequences of LGBT propaganda,134,"Georgian lawmaker urges UN not to confuse the rights of minorities with the harmful consequences of LGBT propaganda. The government of the Caucasus nation of Georgia recently introduced an anti-LGBT propaganda bill. Parliament Majority Leader Mamuka Mdinaradze of the governing Georgian Dream Party said this decision comes as the government accuses LGBT advocacy groups, incl…",2,georgian lawmaker urge un confuse right minority harmful consequence propaganda government caucasus nation georgia recently introduce anti propaganda bill parliament majority leader mamuka mdinaradze govern georgian dream party decision come government accuse advocacy group incl …,"bill, anti, ban, marriage, new, law","251,167,152,151"
130,Living with disability and being queer poses a 'double whammy' of accessibility challenges,135,"Living with disability and being queer poses a 'double whammy' of accessibility challenges. Accessibility isn't just about being able to get on a bus or use a public toilet. Queer people with disability say they often feel like they're being ""marginalised even on the margins"".",5,live disability pose double whammy accessibility challenge accessibility able bus use public toilet disability feel like marginalise margin,"community, sanctuary, city, transgender, group","229,34,154,175"
