,title,news_id,text,cluster,processed_text,keywords,repre_news
333,UN Human Rights Council Passes Landmark Resolution Protecting Rights Of Intersex People,264,UN Human Rights Council Passes Landmark Resolution Protecting Rights Of Intersex People. The resolution requires the Office of the High Commissioner to create a report examining harmful and discriminatory practices against people with intersex traits.,7,un human rights council passes landmark resolution protecting rights intersex resolution require office high commissioner create report examine harmful discriminatory practice intersex trait,"gender, vatican, surrogacy, right, intersex, resolution","268,264,296,299"
247,"In 'Ripley,' Andrew Scott channels queer-coded killers and noir antiheroes",265,"In 'Ripley,' Andrew Scott channels queer-coded killers and noir antiheroes. Actor Andrew Scott has turned his attention to portraying perhaps one of the most memorable literary figures of the 20th century: Patricia Highsmith’s Tom Ripley.",3,ripley andrew scott channel code killer noir antihero actor andrew scott turn attention portray memorable literary figure 20th century patricia highsmith tom ripley,"new, star, film, actor, audience, love","7,20,366,22"
205,Gay rights activists call for more international pressure on Uganda over anti-gay law,266,Gay rights activists call for more international pressure on Uganda over anti-gay law. Ugandan gay rights activists asked the international community to mount more pressure on the government of Uganda to repeal an anti-gay law which the country’s Constitutional Court refused to nullify on Wednesday,2,right activist international pressure uganda anti law ugandan right activist ask international community mount pressure government uganda repeal anti law country constitutional court refuse nullify wednesday,"bill, anti, ban, marriage, new, law","251,167,152,151"
109,Magda Eriksson Shocked By Emma Hayes’ Comments About Player Relationships,267,"Magda Eriksson Shocked By Emma Hayes’ Comments About Player Relationships. Swedish captain Magdalena Eriksson said she was ""shocked"" by comments by her former coach Emma Hayes labelling relationships between women's soccer players as ""inappro...",4,magda eriksson shocked emma hayes comment player relationships swedish captain magdalena eriksson shocked comment coach emma hayes labelling relationship soccer player inappro ...,"trump, new, republican, face, drag, health","230,83,59,63"
334,U.N. rights body adopts first resolution to protect rights of intersex people,268,"U.N. rights body adopts first resolution to protect rights of intersex people. The United Nations Human Rights Council voted to adopt a resolution designed to protect the rights of intersex people, the first initiative of its kind.",7,u.n. right body adopt resolution protect right intersex united nations human rights council vote adopt resolution design protect right intersex initiative kind,"gender, vatican, surrogacy, right, intersex, resolution","268,264,296,299"
110,Conservative school board candidates handed humiliating loss in St. Louis area,269,"Conservative school board candidates handed humiliating loss in St. Louis area. Out of 13 candidates endorsed by local right-wing radio talk show host Marc Cox, zero won their races this week.",4,conservative school board candidate hand humiliating loss st. louis area 13 candidate endorse local right wing radio talk host marc cox zero win race week,"trump, new, republican, face, drag, health","230,83,59,63"
111,Hunt praises MP's apology over dating app incident,270,Hunt praises MP's apology over dating app incident. The chancellor says William Wragg showed courage in admitting he gave out MPs' phone numbers.,4,hunt praise mp apology date app incident chancellor william wragg courage admit mps phone number,"trump, new, republican, face, drag, health","230,83,59,63"
305,How is Scotland's new hate crime law going so far?,271,"How is Scotland's new hate crime law going so far?. Thousands of police complaints, a minister's inaccuracy and more heated debate - all in the law's first week.",8,scotland new hate crime law far thousand police complaint minister inaccuracy heated debate law week,"russia, right, face, hate, man, new","260,101,44,252"
56,Saudi Arabia Hasn’t Earned Women’s Tennis Championships,272,"Saudi Arabia Hasn’t Earned Women’s Tennis Championships. Why is the flagship event for women's tennis going to Saudi Arabia, where critics are jailed and the male guardianship system denies women and girls basic human rights?",6,saudi arabia earn women tennis championships flagship event tennis saudi arabia critic jail male guardianship system deny girl basic human right,"transgender, sport, athlete, court, ban","239,235,81,331"
206,How anti-LGBTQ+ legislation is impacting businesses and individuals,273,"How anti-LGBTQ+ legislation is impacting businesses and individuals. The United States is in the middle of a culture war. Headlines are full of lawmakers and social commentators vilifying everything from pronouns to healthcare, to the books in grade school libraries, to youth sports, bathrooms, and beyond. It seems danger is l…",2,anti lgbtq+ legislation impact business individual united states middle culture war headline lawmaker social commentator vilify pronoun healthcare book grade school library youth sport bathroom danger l …,"bill, anti, ban, marriage, new, law","251,167,152,151"
322,Biden warns Netanyahu about the U.S.' Gaza policy; No Labels backs out of 2024 race,274,Biden warns Netanyahu about the U.S.' Gaza policy; No Labels backs out of 2024 race. Israel will let aid into northern Gaza after Biden warned that U.S. support would depend on how Israel addresses civilian suffering. No Labels has backed out of the 2024 presidential election.,1,biden warn netanyahu u.s. gaza policy label 2024 race israel let aid northern gaza biden warn u.s. support depend israel address civilian suffering labels 2024 presidential election,"eurovision, boycott, growth, gaza, israel, song","192,172,274,21"
306,"A Ugandan LGBTQ+ activist was stabbed and left for dead in the street. Now, he recounts his escape to Canada",275,"A Ugandan LGBTQ+ activist was stabbed and left for dead in the street. Now, he recounts his escape to Canada. “Marks that will never leave my body,” reads the caption of one of Steven Kabuye’s social posts after he was attacked earlier this year. “These scars should remind everyone how the Anti-Homosexuality Act 2023 has legalized homophobia in Uganda.”",8,ugandan lgbtq+ activist stab leave dead street recount escape canada mark leave body caption steven kabuye social post attack early year scar remind anti homosexuality act 2023 legalize homophobia uganda,"russia, right, face, hate, man, new","260,101,44,252"
248,Katya Zamolodchikova Talks Sex And New Season Of Grindr Podcast,276,"Katya Zamolodchikova Talks Sex And New Season Of Grindr Podcast. While Zamolodchikova has experience in the hosting and podcast spaces, he was still worried, though excited about the new show.",3,katya zamolodchikova talks sex new season grindr podcast zamolodchikova experience hosting podcast space worried excited new,"new, star, film, actor, audience, love","7,20,366,22"
335,"The queerness of King James I, of Bible fame",277,"The queerness of King James I, of Bible fame. The King James Version of the Bible is the preferred version of many fundamentalist Christian churches — and the one being hawked by Donald Trump in a “God Bless the USA” edition, with the addition of the U.S. Constitution, Declaration of Independence, and Pl…",7,queerness king james bible fame king james version bible preferred version fundamentalist christian church — hawk donald trump god bless usa edition addition u.s. constitution declaration independence pl …,"gender, vatican, surrogacy, right, intersex, resolution","268,264,296,299"
365,4/4/24,278,"4/4/24. Hi all, We hope you have been enjoying these early April days and that you've ordered your eclipse gear. Here's what we've been working on the last couple of days.  A sex scandal sunk the political career of a Florida Republican couple who seemed on their…",9,4/4/24 hi hope enjoy early april day order eclipse gear work couple day sex scandal sink political career florida republican couple …,"day, transgender, visibility, biden, president, trump","262,317,216,246"
249,Trans Harvard Professor Boasts About Taylor Swift Course: 'It's Her World And We Live in it',279,"Trans Harvard Professor Boasts About Taylor Swift Course: 'It's Her World And We Live in it'. A transgender Harvard professor is boasting about a new course, titled, ""Taylor Swift and Her World,"" which began in February at the Ivy League university.
The post Trans Harvard Professor Boasts About Taylor Swift Course: ‘It’s Her World And We Live in it’ a…",3,trans harvard professor boast taylor swift course world live transgender harvard professor boast new course title taylor swift world begin february ivy league university post trans harvard professor boast taylor swift course ’ world live …,"new, star, film, actor, audience, love","7,20,366,22"
112,Lesbian News publisher Ella Matthes has died at 81,280,"Lesbian News publisher Ella Matthes has died at 81. Ella Matthes, the longtime publisher and editor of Lesbian News Magazine, died March 16 at a hospital in Norwalk, Calif. She was 81 years old, and the cause was a heart attack, according to a press release.",4,lesbian news publisher ella matthes die 81 ella matthes longtime publisher editor lesbian news magazine die march 16 hospital norwalk calif. 81 year old cause heart attack accord press release,"trump, new, republican, face, drag, health","230,83,59,63"
113,Horan penalty sends USA into SheBelieves Cup final,281,Horan penalty sends USA into SheBelieves Cup final. Lindsey Horan converts a 77th-minute penalty to give the United States a 2-1 win over Japan and send them into the final of the SheBelieves Cup.,4,horan penalty send usa shebelieves cup final lindsey horan convert 77th minute penalty united states 2 1 win japan send final shebelieves cup,"trump, new, republican, face, drag, health","230,83,59,63"
207,Report: LGBTQ content drove book banning efforts in 2023,282,"Report: LGBTQ content drove book banning efforts in 2023. According to the American Library Association, LGBTQ content drove book-banning efforts in 2023. “Gender Queer,” by Maia Kobabe topped the list for the third year.",2,report content drive book ban effort 2023 accord american library association content drive book ban effort 2023 gender maia kobabe list year,"bill, anti, ban, marriage, new, law","251,167,152,151"
57,NAIA all but bans transgender athletes from women's sports,283,"NAIA all but bans transgender athletes from women's sports. The National Association of Intercollegiate Athletics, which oversees some 83,000 athletes competing in more than 25 sports, is thought to be the first college sports organization to take such a step.",6,"naia ban transgender athlete sport national association intercollegiate athletics oversee 83,000 athlete compete 25 sport think college sport organization step","transgender, sport, athlete, court, ban","239,235,81,331"
114,Ministers 'caught by surprise' over hate crime row,284,Ministers 'caught by surprise' over hate crime row. Former health secretary Jeane Freeman also believes misogyny should have been included in the new law.,4,minister catch surprise hate crime row health secretary jeane freeman believe misogyny include new law,"trump, new, republican, face, drag, health","230,83,59,63"
115,Prominent LGBTQ activist and president of a university queer organization ARRESTED for downloading child pornography,285,"Prominent LGBTQ activist and president of a university queer organization ARRESTED for downloading child pornography. A 53-year-old LGBTQ activist and president of the Queer Alumni Club at Princeton University has been arrested for downloading child pornography. Roy “Trey” Farmer, a former “piano prodigy,” holds a bachelor’s degree in classical philosophy from Princeton, a M…",4,prominent activist president university organization arrest download child pornography 53 year old activist president alumni club princeton university arrest download child pornography roy trey farmer piano prodigy hold bachelor degree classical philosophy princeton m …,"trump, new, republican, face, drag, health","230,83,59,63"
116,"Inflation alarm, 'extraordinary' AI: 4 takeaways from Jamie Dimon's annual letter",286,"Inflation alarm, 'extraordinary' AI: 4 takeaways from Jamie Dimon's annual letter. The CEO of the nation's largest bank said economic risks remain significant.",4,inflation alarm extraordinary ai 4 takeaway jamie dimon annual letter ceo nation large bank economic risk remain significant,"trump, new, republican, face, drag, health","230,83,59,63"
336,Vatican condemns gender-affirming surgery as threatening ‘unique dignity’ of a person,287,"Vatican condemns gender-affirming surgery as threatening ‘unique dignity’ of a person. The document, which also goes after abortion and surrogacy, was approved by Pope Francis, who has had a mixed record on LGBTQ+ rights support.",7,vatican condemn gender affirm surgery threaten unique dignity person document abortion surrogacy approve pope francis mixed record lgbtq+ right support,"gender, vatican, surrogacy, right, intersex, resolution","268,264,296,299"
323,Chaya Milchtein Is Using Her Automotive Knowledge To Empower Others,288,"Chaya Milchtein Is Using Her Automotive Knowledge To Empower Others. This writer, influencer and expert has published a guide on car ownership.",1,chaya milchtein use automotive knowledge empower writer influencer expert publish guide car ownership,"eurovision, boycott, growth, gaza, israel, song","192,172,274,21"
307,"The North Face, Target now funding LGBT youth camp teaching children to be “genderless” drag stars",289,"The North Face, Target now funding LGBT youth camp teaching children to be “genderless” drag stars. A reeducation camp for children that teaches little ones how to become “genderless” drag queens is in the news after its corporate sponsors were revealed to include household names like Target, The North Face, Chaco, Toms and Brooks, among others. The so-call…",8,north face target fund youth camp teach child genderless drag star reeducation camp child teach little genderless drag queens news corporate sponsor reveal include household like target north face chaco toms brooks …,"russia, right, face, hate, man, new","260,101,44,252"
337,Vatican stands firm on sex change and surrogacy,290,"Vatican stands firm on sex change and surrogacy. The Vatican remains opposed to concepts like abortion and euthanasia, describing them as ""grave violations"".",7,vatican stand firm sex change surrogacy vatican remain oppose concept like abortion euthanasia describe grave violation,"gender, vatican, surrogacy, right, intersex, resolution","268,264,296,299"
324,Inclusive Marketing Is About Relevance And Growth,291,"Inclusive Marketing Is About Relevance And Growth. People look for themselves reflected in how a company chooses to market themselves. If they don't see people who look like them, the won't do business with you.",1,inclusive marketing relevance growth look reflect company choose market look like business,"eurovision, boycott, growth, gaza, israel, song","192,172,274,21"
58,US women's football team: Will new generation still fight for social causes?,292,US women's football team: Will new generation still fight for social causes?. The responsibility of what it means to play for the US' women's football team has always been more than just the game. Will the new generation continue to champion marginalized communities?,6,football team new generation fight social cause responsibility mean play football team game new generation continue champion marginalize community,"transgender, sport, athlete, court, ban","239,235,81,331"
338,World’s first transgender clinic was formed in Germany in 1919 by gay Jewish doctor,293,"World’s first transgender clinic was formed in Germany in 1919 by gay Jewish doctor. One of the primary reasons why Naziism swept Germany in the early 20th century is because of the rampant wickedness and perversion that had taken over, including at the hands of homosexual Jewish doctor Magnus Hirschfeld, who created the world’s first transge…",7,world transgender clinic form germany 1919 jewish doctor primary reason naziism sweep germany early 20th century rampant wickedness perversion include hand homosexual jewish doctor magnus hirschfeld create world transge …,"gender, vatican, surrogacy, right, intersex, resolution","268,264,296,299"
208,Here are the most challenged books of 2023,294,"Here are the most challenged books of 2023. The American Library Association released a list detailing the 10 most challenged titles of 2023 — seven of which deal with LGBTQ themes, according to the group.",2,challenge book 2023 american library association release list detail 10 challenge title 2023 — seven deal theme accord group,"bill, anti, ban, marriage, new, law","251,167,152,151"
250,The Advocate's Jake Shears cover: Go behind the scenes,295,"The Advocate's Jake Shears cover: Go behind the scenes. Advocate Channel's newest program, Cover to Cover, goes in-depth with equalpride's iconic publications — The Advocate, Out, and Plus.",3,advocate jake shears cover scene advocate channel new program cover cover depth equalpride iconic publication — advocate plus,"new, star, film, actor, audience, love","7,20,366,22"
339,"Vatican blasts gender-affirming surgery, surrogacy and gender theory as violations of human dignity",296,"Vatican blasts gender-affirming surgery, surrogacy and gender theory as violations of human dignity. The Vatican on Monday declared gender-affirming surgery and surrogacy as grave violations of human dignity, putting them on par with abortion and euthanasia as practices that reject God’s plan for human life.",7,vatican blast gender affirm surgery surrogacy gender theory violation human dignity vatican monday declare gender affirm surgery surrogacy grave violation human dignity par abortion euthanasia practice reject god plan human life,"gender, vatican, surrogacy, right, intersex, resolution","268,264,296,299"
117,Melania Trump Makes Rare Fundraising Appearance: Here’s Her Rare Public Outings Since Leaving The White House,297,Melania Trump Makes Rare Fundraising Appearance: Here’s Her Rare Public Outings Since Leaving The White House. A timeline of the former first lady’s rare public appearances since leaving the White House in 2021.,4,melania trump rare fundraising appearance ’ rare public outings leave white house timeline lady rare public appearance leave white house 2021,"trump, new, republican, face, drag, health","230,83,59,63"
118,"Golden Globes Host Jerrod Carmichael Calls Dave Chappelle an 'Egomaniac,' Says Gay Jokes Still 'Scary for Me'",298,"Golden Globes Host Jerrod Carmichael Calls Dave Chappelle an 'Egomaniac,' Says Gay Jokes Still 'Scary for Me'. Gay comedian Jerrod Carmichael won't drop his beef with Dave Chappelle.
The post Golden Globes Host Jerrod Carmichael Calls Dave Chappelle an ‘Egomaniac,’ Says Gay Jokes Still ‘Scary for Me’ appeared first on Breitbart.",4,golden globes host jerrod carmichael dave chappelle egomaniac jokes scary comedian jerrod carmichael drop beef dave chappelle post golden globes host jerrod carmichael dave chappelle egomaniac jokes scary appear breitbart,"trump, new, republican, face, drag, health","230,83,59,63"
340,"Vatican Condemns Gender-Affirming Surgery, Gender Theory And Surrogacy As Threats To Human ‘Dignity’",299,"Vatican Condemns Gender-Affirming Surgery, Gender Theory And Surrogacy As Threats To Human ‘Dignity’. Pope Francis and the Vatican rejected gender-affirming surgery, gender theory and surrogacy as major threats in line with Catholic teachings on abortion, euthanasia and assisted suicide.",7,vatican condemns gender affirming surgery gender theory surrogacy threats human dignity pope francis vatican reject gender affirm surgery gender theory surrogacy major threat line catholic teaching abortion euthanasia assist suicide,"gender, vatican, surrogacy, right, intersex, resolution","268,264,296,299"
59,"Trans athletes should be allowed to play women's sports, South Carolina coach Dawn Staley says",300,"Trans athletes should be allowed to play women's sports, South Carolina coach Dawn Staley says. Transgender athletes should be allowed to compete in women’s sports, South Carolina women’s basketball coach Dawn Staley said ahead of her team’s NCAA Tournament championship game.",6,trans athlete allow play sport south carolina coach dawn staley transgender athlete allow compete sport south carolina basketball coach dawn staley ahead team ncaa tournament championship game,"transgender, sport, athlete, court, ban","239,235,81,331"
16,The Quiet Bomb: How DEI Went From Aspiration To Conflagration - And How To Put Out The Fire,301,"The Quiet Bomb: How DEI Went From Aspiration To Conflagration - And How To Put Out The Fire. As the Amherst School District debacle reveals, DEI needs a new approach and a radical pivot to extinguish the flames of division and the current us-versus-them fire.",0,quiet bomb dei aspiration conflagration fire amherst school district debacle reveal dei need new approach radical pivot extinguish flame division current versus fire,"student, death, benedict, nex, charge","36,90,102,100"
60,Louisiana’s transgender ‘bathroom bill’ clears first hurdle,302,"Louisiana’s transgender ‘bathroom bill’ clears first hurdle. A bill that that would effectively bar transgender people in Louisiana from using restrooms, locker rooms and sleeping quarters that correspond with their gender identity advanced out of a state legislative committee Monday.",6,louisiana transgender bathroom bill clear hurdle bill effectively bar transgend louisiana use restroom locker room sleeping quarter correspond gender identity advance state legislative committee monday,"transgender, sport, athlete, court, ban","239,235,81,331"
61,NAIA bans transgender women from competing in women’s sports,303,NAIA bans transgender women from competing in women’s sports. The National Association of Intercollegiate Athletics has rolled out a new policy that bans trans women from competing in women’s sports at more than 200 mostly small colleges.,6,naia ban transgend compete sport national association intercollegiate athletics roll new policy ban tran compete sport 200 small college,"transgender, sport, athlete, court, ban","239,235,81,331"
62,Trans women banned from netball internationals,304,Trans women banned from netball internationals. World Netball bans transgender women from international level women's competition with immediate effect under a new participation and inclusion policy.,6,trans ban netball international world netball ban transgend international level competition immediate effect new participation inclusion policy,"transgender, sport, athlete, court, ban","239,235,81,331"
140,New research helps explain why lesbians report more orgasms than straight women,305,New research helps explain why lesbians report more orgasms than straight women. A new study published in Sage this month found that differences in the amount of orgasms women have could be in part due to sexual scripts.,5,new research help explain lesbian report orgasms straight new study publish sage month find difference orgasm sexual script,"community, sanctuary, city, transgender, group","229,34,154,175"
251,From ‘The Real World’ To ‘Queer Eye’ To Daytime Talk: Karamo Brown Focuses On Mental Health And Family,306,"From ‘The Real World’ To ‘Queer Eye’ To Daytime Talk: Karamo Brown Focuses On Mental Health And Family. Television and podcast host, reality television personality, author, actor, entrepreneur, and activist.",3,real world eye daytime talk karamo brown focus mental health family television podcast host reality television personality author actor entrepreneur activist,"new, star, film, actor, audience, love","7,20,366,22"
63,GOP Rep. Nancy Mace gets roasted for attacking her state’s NCAA champion Dawn Staley on transgender players,307,"GOP Rep. Nancy Mace gets roasted for attacking her state’s NCAA champion Dawn Staley on transgender players. The University of South Carolina celebrated its third national championship under the guidance of famed coach Dawn Staley on Sunday in a remarkable victory over the Iowa Hawkeyes. However, the achievement was overshadowed in some circles by a contentious deba…",6,gop rep. nancy mace roast attack state ncaa champion dawn staley transgender player university south carolina celebrate national championship guidance famed coach dawn staley sunday remarkable victory iowa hawkeyes achievement overshadow circle contentious deba …,"transgender, sport, athlete, court, ban","239,235,81,331"
366,Pope Francis can’t seem to decide whether the church should welcome or condemn trans people,308,"Pope Francis can’t seem to decide whether the church should welcome or condemn trans people. On Easter Sunday, Caitlyn Jenner threw a Eucharistic hissy fit, lying (it was a lie — she knew it had been observed on March 31 since 2009) that President Joe Biden had decreed Transgender Day of Visibility on the same day as Easter Sunday. Oh, the heathen th…",9,pope francis decide church welcome condemn tran easter sunday caitlyn jenner throw eucharistic hissy fit lie lie — know observe march 31 2009 president joe biden decree transgender day visibility day easter sunday oh heathen th …,"day, transgender, visibility, biden, president, trump","262,317,216,246"
