,title,news_id,text,cluster,processed_text,keywords,repre_news
350,Biden issues proclamation for Transgender Day of Visibility amid Republican attacks on trans rights,180,"Biden issues proclamation for Transgender Day of Visibility amid Republican attacks on trans rights. On Friday, President Joe Biden reaffirmed his administration’s commitment to transgender rights by declaring March 31 as Transgender Day of Visibility in a White House proclamation. This day, dedicated to honoring the courage and contributions of transgender …",9,biden issue proclamation transgender day visibility amid republican attack tran right friday president joe biden reaffirm administration commitment transgender right declare march 31 transgender day visibility white house proclamation day dedicate honor courage contribution transgender …,"day, transgender, visibility, biden, president, trump","262,317,216,246"
236,Michaela Jaé Rodriguez is 'thankful' to inspire the LGBTQ+ community through her trailblazing career,181,"Michaela Jaé Rodriguez is 'thankful' to inspire the LGBTQ+ community through her trailblazing career. In a new interview with The Advocate, the trans actress is opening up on her journey to her success.",3,michaela jaé rodriguez thankful inspire lgbtq+ community trailblaze career new interview advocate tran actress open journey success,"new, star, film, actor, audience, love","7,20,366,22"
237,Jojo Siwa’s New Single Hits The Billboard Charts–And It’s Not Even Out Yet,182,"Jojo Siwa’s New Single Hits The Billboard Charts–And It’s Not Even Out Yet. Jojo Siwa's upcoming single ""Karma"" makes a splash on the TikTok Billboard Top 50 chart, signaling her evolution towards a more adult audience.",3,jojo siwa new single hits billboard charts – ’ jojo siwa upcoming single karma splash tiktok billboard 50 chart signal evolution adult audience,"new, star, film, actor, audience, love","7,20,366,22"
97,Listen to Dr. Levine: Take syphilis seriously,183,"Listen to Dr. Levine: Take syphilis seriously. When Dr. Rachel Levine, a pediatrician who oversaw Pennsylvania’s health system, was nominated and approved to be the Assistant Secretary for Health at the U.S. Department of Health and Human Services, the LGBTQ+ community and allies erupted in celebration an…",4,listen dr. levine syphilis seriously dr. rachel levine pediatrician oversee pennsylvania health system nominate approve assistant secretary health u.s. department health human services lgbtq+ community ally erupt celebration …,"trump, new, republican, face, drag, health","230,83,59,63"
193,Biden White House attacks Republicans for modest restrictions on LGBT ‘pride’ flags,184,"Biden White House attacks Republicans for modest restrictions on LGBT ‘pride’ flags. It has been less than a decade since the U.S. Supreme Court mandated the redefinition of marriage across all 50 states in the Obergefell v. Hodges decision, transforming legal regimes across America overnight. To celebrate, President Barack Obama lit up the W…",2,biden white house attack republicans modest restriction pride flag decade u.s. supreme court mandate redefinition marriage 50 state obergefell v. hodges decision transform legal regime america overnight celebrate president barack obama light w …,"bill, anti, ban, marriage, new, law","251,167,152,151"
98,Drag queen feted by Kamala Harris accused of multiple sexual assaults,185,"Drag queen feted by Kamala Harris accused of multiple sexual assaults. A drag star feted by Kamala Harris at the Biden White House and Vice President’s residence has been accused of multiple sexual assaults between 2012 to 2020. (Article by Debra Heine republished from AMGreatness.com) Darius Jeremy “DJ” Pierce, better known as …",4,drag queen fete kamala harris accuse multiple sexual assault drag star fete kamala harris biden white house vice president residence accuse multiple sexual assault 2012 2020 debra heine republish amgreatness.com darius jeremy dj pierce know …,"trump, new, republican, face, drag, health","230,83,59,63"
238,Comedians Robert Watson and Al Val are bringing their Gay AF Comedy show to Montreal,186,"Comedians Robert Watson and Al Val are bringing their Gay AF Comedy show to Montreal. The Toronto LGBTQ showcase is about to head on a big cross-country tour, with local comedians joining along the way.",3,comedians robert watson al val bring af comedy montreal toronto showcase head big cross country tour local comedian join way,"new, star, film, actor, audience, love","7,20,366,22"
239,Olivia Colman Reflects On Her Beloved Career: ‘I Have Been Very Lucky’,187,"Olivia Colman Reflects On Her Beloved Career: ‘I Have Been Very Lucky’. The Academy Award winner discusses her new ""Wicked Little Letters"" film, her mindset towards projects today and reveals if she will be in ""Heartstopper"" season three.",3,olivia colman reflect beloved career lucky academy award winner discuss new wicked little letters film mindset project today reveal heartstopper season,"new, star, film, actor, audience, love","7,20,366,22"
319,"Mpox is on the rise: Who's eligible for a vaccine, and do you need a booster?",188,"Mpox is on the rise: Who's eligible for a vaccine, and do you need a booster?. Mpox cases are on the rise, who's eligible for a vaccine according to the CDC.",1,mpox rise eligible vaccine need booster mpox case rise eligible vaccine accord cdc,"eurovision, boycott, growth, gaza, israel, song","192,172,274,21"
351,Trump Campaign Blasts Biden For Recognizing ‘Transgender Day Of Visibility’ On Easter Sunday—But Visibility Day Always Falls On March 31,189,Trump Campaign Blasts Biden For Recognizing ‘Transgender Day Of Visibility’ On Easter Sunday—But Visibility Day Always Falls On March 31. The Trump campaign and other prominent conservatives attacked Biden for recognizing Transgender Day of Visibility on Easter Sunday.,9,trump campaign blast biden recognize transgender day visibility easter sunday — visibility day falls march 31 trump campaign prominent conservative attack biden recognize transgender day visibility easter sunday,"day, transgender, visibility, biden, president, trump","262,317,216,246"
290,Russian queer club execs added to list of terrorists,190,Russian queer club execs added to list of terrorists. Two managers of the ‘Pose’ nightclub in Russia have been added to a register of persons involved in extremist or terrorist activities Read Full Article at RT.com,8,russian club exec add list terrorist manager pose nightclub russia add register person involve extremist terrorist activity rt.com,"russia, right, face, hate, man, new","260,101,44,252"
240,Graphic novel tells the stories of LGTBQ people over 50,191,Graphic novel tells the stories of LGTBQ people over 50. A forthcoming anthology by Berlin-based queer comic publisher Moom Comics illustrates the stories of older LGTBQ people. It aims to bridge the age gap.,3,graphic novel tell story lgtbq 50 forthcoming anthology berlin base comic publisher moom comics illustrate story old lgtbq aim bridge age gap,"new, star, film, actor, audience, love","7,20,366,22"
320,Nine Eurovision Acts Call For Israel-Hamas Cease-Fire—But Will Stop Short Of Boycott,192,Nine Eurovision Acts Call For Israel-Hamas Cease-Fire—But Will Stop Short Of Boycott. Numerous groups have called for boycotts of Eurovision due to Israel’s inclusion in the competition.,1,eurovision act israel hamas cease fire — stop short boycott numerous group boycott eurovision israel inclusion competition,"eurovision, boycott, growth, gaza, israel, song","192,172,274,21"
99,USWNT’s Korbin Albert apologizes after reports of anti-LGBTQ+ reposts,193,"USWNT’s Korbin Albert apologizes after reports of anti-LGBTQ+ reposts. USWNT midfielder Korbin Albert apologized on Thursday night for liking and sharing social media posts that she described as “offensive, insensitive and hurtful.” The 20-year-old Albert, who plays for Paris Saint-Germain, had reportedly reposted anti-LGBTQ+ co…",4,uswnt korbin albert apologize report anti lgbtq+ repost uswnt midfielder korbin albert apologize thursday night like share social medium post describe offensive insensitive hurtful 20 year old albert play paris saint germain reportedly reposte anti lgbtq+ co …,"trump, new, republican, face, drag, health","230,83,59,63"
241,The 30 Top Drama Movies Of All Time,194,"The 30 Top Drama Movies Of All Time. Dive into the film industry’s best drama movies of all time. From Boyz N The Hood to Casablanca, discover the powerful performances that have shaped drama.",3,30 drama movies time dive film industry good drama movie time boyz n hood casablanca discover powerful performance shape drama,"new, star, film, actor, audience, love","7,20,366,22"
100,Ministering to death row: An unlikely friendship based on a shared calling,195,"Ministering to death row: An unlikely friendship based on a shared calling. Rev. Lauren Bennett, 33, leads a St. Louis church serving the LGBTQ+ community, and Father Gerry Kleba, 82, a retired Catholic priest, talk about ministering to inmates on death row in Missouri.",4,minister death row unlikely friendship base share calling rev. lauren bennett 33 lead st. louis church serve lgbtq+ community father gerry kleba 82 retire catholic priest talk minister inmate death row missouri,"trump, new, republican, face, drag, health","230,83,59,63"
352,Equalpride's CEO on standing together this Transgender Day of Visibility,196,"Equalpride's CEO on standing together this Transgender Day of Visibility. This Sunday marks Transgender Day of Visibility, a day dedicated to celebrating the strength, diversity, and resilience of the transgender community. As we come together in solidarity, it's essential to acknowledge the context in which we find ourselves this …",9,equalpride ceo stand transgender day visibility sunday mark transgender day visibility day dedicate celebrate strength diversity resilience transgender community come solidarity essential acknowledge context find …,"day, transgender, visibility, biden, president, trump","262,317,216,246"
321,Eurovision stars say they can’t be silent but reject calls for boycott over Israel,197,Eurovision stars say they can’t be silent but reject calls for boycott over Israel. Artists set to compete in the Eurovision Song Contest said they do not want to be silent in light of the ongoing Israeli military offensive in the Gaza Strip.,1,eurovision star silent reject boycott israel artist set compete eurovision song contest want silent light ongoing israeli military offensive gaza strip,"eurovision, boycott, growth, gaza, israel, song","192,172,274,21"
291,A Florida activist creates safe spaces as laws and rhetoric turn against trans rights,198,"A Florida activist creates safe spaces as laws and rhetoric turn against trans rights. In founding Capital Tea, Janel Diaz sought to provide the kind of services that she had needed after her transition.",8,florida activist create safe space law rhetoric turn tran right found capital tea janel diaz seek provide kind service need transition,"russia, right, face, hate, man, new","260,101,44,252"
353,WH bashes 'dishonest' GOP criticism of Biden's transgender proclamation on Easter,199,WH bashes 'dishonest' GOP criticism of Biden's transgender proclamation on Easter. The White House is pushing back against top Republicans' misleading criticism of Biden's Transgender Day of Visibility proclamation on the same day as Easter,9,wh bash dishonest gop criticism biden transgender proclamation easter white house push republicans mislead criticism biden transgender day visibility proclamation day easter,"day, transgender, visibility, biden, president, trump","262,317,216,246"
354,Transgender Day of Visibility is the day to elevate the voices of the marginalized (exclusive),200,"Transgender Day of Visibility is the day to elevate the voices of the marginalized (exclusive). The Transgender Day of Visibility, celebrated annually on March 31, is a day dedicated to honoring the vibrance, diversity, and resilience of the transgender community. This year, the Human Rights Campaign, the nation’s largest LGBTQ+ civil rights organizatio…",9,transgender day visibility day elevate voice marginalize exclusive transgender day visibility celebrate annually march 31 day dedicate honor vibrance diversity resilience transgender community year human rights campaign nation large lgbtq+ civil right organizatio …,"day, transgender, visibility, biden, president, trump","262,317,216,246"
292,LGBTQ+ club owner arrested in Russia for 'extremism',201,LGBTQ+ club owner arrested in Russia for 'extremism'. The owner of a popular gay bar was arrested and will face trial with two of his employees amid the latest crackdown on LGBT rights in Russia.,8,lgbtq+ club owner arrest russia extremism owner popular bar arrest face trial employee amid late crackdown right russia,"russia, right, face, hate, man, new","260,101,44,252"
293,LGBTQ+ club owner arrested in Russia extremism,202,LGBTQ+ club owner arrested in Russia extremism. The owner of a popular gay bar was arrested and will face trial with two of his employees in the latest crackdown on LGBTQ+ rights in Russia.,8,lgbtq+ club owner arrest russia extremism owner popular bar arrest face trial employee late crackdown lgbtq+ right russia,"russia, right, face, hate, man, new","260,101,44,252"
294,Trans Latina woman fighting to shut down ICE facilities honored with human rights award,203,"Trans Latina woman fighting to shut down ICE facilities honored with human rights award. Arely Westley, this year's recipient of the Robert F. Kennedy Human Rights Award, tells The Advocate about this ""crucial moment"" in time for queer and immigrant communities.",8,trans latina fight shut ice facility honor human right award arely westley year recipient robert f. kennedy human rights award tell advocate crucial moment time immigrant community,"russia, right, face, hate, man, new","260,101,44,252"
295,LGBT club owner arrested in Russia extremism,204,LGBT club owner arrested in Russia extremism. The owner of a popular gay bar was arrested and will face trial with two of his employees amid the latest crackdown on LGBT rights in Russia.,8,club owner arrest russia extremism owner popular bar arrest face trial employee amid late crackdown right russia,"russia, right, face, hate, man, new","260,101,44,252"
296,"Lesbian Power Couple: Top Sniper, Machine-Gunner Taking on Vlad's Army...",205,"Lesbian Power Couple: Top Sniper, Machine-Gunner Taking on Vlad's Army.... Lesbian Power Couple: Top Sniper, Machine-Gunner Taking on Vlad's Army...

 
 
 
 (Third column, 10th story, link)

 

 

 
 Related stories:Putin Friend Predicts Nuke Strike 'Most Likely' Coming...
NATO must be ready for Russia to invade our countries, …",8,lesbian power couple sniper machine gunner vlad army .... lesbian power couple sniper machine gunner vlad army ... column 10th story link relate story putin friend predicts nuke strike likely come ... nato ready russia invade country …,"russia, right, face, hate, man, new","260,101,44,252"
137,10 transgender people share the 'strength and joy' of their lives after transition,206,"10 transgender people share the 'strength and joy' of their lives after transition. Transgender people overwhelmingly describe their lives after transitioning as “happier,” “authentic” and “comforting” despite a deluge of state legislation that seeks to restrict their access to health care and other aspects of life.",5,10 transgender share strength joy life transition transgender overwhelmingly describe life transition happy authentic comfort despite deluge state legislation seek restrict access health care aspect life,"community, sanctuary, city, transgender, group","229,34,154,175"
242,Wanderful Founder Beth Santos Is Giving Women Updated Advice On Solo Travel,207,"Wanderful Founder Beth Santos Is Giving Women Updated Advice On Solo Travel. Along with providing resources and tips, this trailblazer's debut book examines how this way of seeing the world should be perceived today.",3,wanderful founder beth santos giving women updated advice solo travel provide resource tip trailblazer debut book examine way world perceive today,"new, star, film, actor, audience, love","7,20,366,22"
194,First they tried protests of anti-gay bills. Then students put on a play at Louisiana’s Capitol,208,First they tried protests of anti-gay bills. Then students put on a play at Louisiana’s Capitol. A group of students from a New Orleans high school staged a play they developed on the steps of Louisiana's Capitol to protest a series of anti-LGBTQ+ legislative proposals,2,try protest anti bill student play louisiana capitol group student new orleans high school stage play develop step louisiana capitol protest series anti lgbtq+ legislative proposal,"bill, anti, ban, marriage, new, law","251,167,152,151"
49,Is there really a competitive advantage? Debate over trans athletes tests science and inclusion,209,"Is there really a competitive advantage? Debate over trans athletes tests science and inclusion. In the last few years, debate has raged in North America over who should be allowed to compete in sports. While the discussion revolves around concepts of fairness and inclusion, researchers say the science around whether trans athletes have a competitive adv…",6,competitive advantage debate tran athlete test science inclusion year debate rage north america allow compete sport discussion revolve concept fairness inclusion researcher science tran athlete competitive adv …,"transgender, sport, athlete, court, ban","239,235,81,331"
355,Joe Biden Declares Easter Sunday 'Transgender Day of Visibility',210,"Joe Biden Declares Easter Sunday 'Transgender Day of Visibility'. President Joe Biden's White House has declared the holiest of Christian holidays ""Transgender Day of Visibility.""
The post Joe Biden Declares Easter Sunday ‘Transgender Day of Visibility’ appeared first on Breitbart.",9,joe biden declare easter sunday transgender day visibility president joe biden white house declare holy christian holiday transgender day visibility post joe biden declare easter sunday transgender day visibility appear breitbart,"day, transgender, visibility, biden, president, trump","262,317,216,246"
356,Caitlyn Jenner ‘Absolutely Disgusted’ with Biden over Transgender Day of Visibility,211,"Caitlyn Jenner ‘Absolutely Disgusted’ with Biden over Transgender Day of Visibility. Former Olympic medal-winner Caitlyn Jenner has slammed President Joe Biden for his declaration of Easter Sunday 2024 as “Transgender Day of Visibility.”
The post Caitlyn Jenner ‘Absolutely Disgusted’ with Biden over Transgender Day of Visibility appeared firs…",9,caitlyn jenner absolutely disgusted biden transgender day visibility olympic medal winner caitlyn jenner slam president joe biden declaration easter sunday 2024 transgender day visibility post caitlyn jenner absolutely disgusted biden transgender day visibility appear fir …,"day, transgender, visibility, biden, president, trump","262,317,216,246"
357,Biden proclaims Transgender Day of Visibility on Easter Sunday,212,Biden proclaims Transgender Day of Visibility on Easter Sunday. President Biden is facing an angry backlash from conservative critics after he traditionally declared March 31 as a Trans Visibility Day Read Full Article at RT.com,9,biden proclaim transgender day visibility easter sunday president biden face angry backlash conservative critic traditionally declare march 31 trans visibility day rt.com,"day, transgender, visibility, biden, president, trump","262,317,216,246"
297,Hundreds of Canadian artists denounce 'alarming' anti-trans legislation in open letter,213,"Hundreds of Canadian artists denounce 'alarming' anti-trans legislation in open letter. More than 400 Canadian artists from the worlds of music, film and literature are denouncing what they describe as ""alarming and destructive"" anti-trans legislation in an open letter released Sunday by music superstars Tegan and Sara.",8,canadian artist denounce alarm anti trans legislation open letter 400 canadian artist world music film literature denounce describe alarming destructive anti trans legislation open letter release sunday music superstar tegan sara,"russia, right, face, hate, man, new","260,101,44,252"
358,Trans Day of Visibility began 15 years ago. The founder is still moved by its success,214,"Trans Day of Visibility began 15 years ago. The founder is still moved by its success. Rachel Crandall-Crocker, the founder of International Transgender Day of Visibility, said organizing has taught her one invaluable lesson: ""You do not have to be perfect to change the world.""",9,trans day visibility begin 15 year ago founder success rachel crandall crocker founder international transgender day visibility organizing teach invaluable lesson perfect change world,"day, transgender, visibility, biden, president, trump","262,317,216,246"
13,Dom was paralysed from the waist down when he decided to open his dance studio,215,Dom was paralysed from the waist down when he decided to open his dance studio. Dom Tulleken runs a dance academy for people with a disability. He encourages people to be their true selves — an ethos he lives by.,0,dom paralyse waist decide open dance studio dom tulleken run dance academy disability encourage true self — ethos live,"student, death, benedict, nex, charge","36,90,102,100"
359,Florida GOP Blasts Biden for Declaring Easter Sunday 'Transgender Day of Visibility',216,"Florida GOP Blasts Biden for Declaring Easter Sunday 'Transgender Day of Visibility'. Republican Party of Florida chairman Evan Power blasted President Joe Biden on Saturday for declaring March 31, 2024, Easter Sunday, ""Transgender Day of Visibility.""
The post Florida GOP Blasts Biden for Declaring Easter Sunday ‘Transgender Day of Visibility’…",9,florida gop blasts biden declare easter sunday transgender day visibility republican party florida chairman evan power blast president joe biden saturday declare march 31 2024 easter sunday transgender day visibility post florida gop blasts biden declare easter sunday transgender day visibility …,"day, transgender, visibility, biden, president, trump","262,317,216,246"
50,"Trans corrections officer in Georgia can continue lawsuit, appeals court rules",217,"Trans corrections officer in Georgia can continue lawsuit, appeals court rules. A transgender man in Georgia can continue to pursue his lawsuit against the state’s Department of Corrections, which he says maintained a hostile work environment, the U.S. Court of Appeals for the 11th Circuit ruled Thursday.",6,tran correction officer georgia continue lawsuit appeal court rule transgender man georgia continue pursue lawsuit state department corrections maintain hostile work environment u.s. court appeals 11th circuit rule thursday,"transgender, sport, athlete, court, ban","239,235,81,331"
298,Scotland's new hate crime law... in 90 seconds,218,Scotland's new hate crime law... in 90 seconds. The BBC's James Cook breaks down the debate over a new hate crime law in Scotland which has been causing a stir.,8,scotland new hate crime law ... 90 second bbc james cook break debate new hate crime law scotland cause stir,"russia, right, face, hate, man, new","260,101,44,252"
299,Meet The Team Behind GLAAD’s Black LGBTQ+ Media Advocacy,219,Meet The Team Behind GLAAD’s Black LGBTQ+ Media Advocacy. GLAAD's Communities of Color Department has emerged as a dynamic force for change within the organization and the broader landscape of media and entertainment.,8,meet team glaad black lgbtq+ media advocacy glaad communities color department emerge dynamic force change organization broad landscape medium entertainment,"russia, right, face, hate, man, new","260,101,44,252"
14,Two charged in transgender activist Cecilia Gentili's death,220,Two charged in transgender activist Cecilia Gentili's death. Two people have been charged in the death of transgender activist Cecilia Gentili.,0,charge transgender activist cecilia gentili death charge death transgend activist cecilia gentili,"student, death, benedict, nex, charge","36,90,102,100"
300,Two men charged with distributing illicit drugs in death of transgender activist,221,"Two men charged with distributing illicit drugs in death of transgender activist. Two men were charged with distributing illicit drugs that caused the death of prominent transgender activist, author and actor Cecilia Gentili last month, the Department of Justice said.",8,man charge distribute illicit drug death transgender activist man charge distribute illicit drug cause death prominent transgender activist author actor cecilia gentili month department justice,"russia, right, face, hate, man, new","260,101,44,252"
195,"When even blue states aren't safe from anti-LGBTQ+ laws, this queer mayor is protecting her city",222,"When even blue states aren't safe from anti-LGBTQ+ laws, this queer mayor is protecting her city. Emma Mulvaney-Stanak, the first woman and first out gay mayor of Vermont's largest city, tells The Advocate about how blue states must be proactive instead of reactive in the fight for LGBTQ+ rights.",2,blue state safe anti lgbtq+ law mayor protect city emma mulvaney stanak mayor vermont large city tell advocate blue state proactive instead reactive fight lgbtq+ right,"bill, anti, ban, marriage, new, law","251,167,152,151"
