,title,news_id,text,cluster,processed_text,keywords,repre_news
0,What happened to Nex Benedict?,0,"What happened to Nex Benedict?. Benedict was attacked at their Oklahoma high school, and found dead at home the next day. The medical examiner's office says the nonbinary 16-year-old died by suicide. Their family has questions.",0,happen nex benedict benedict attack oklahoma high school find dead home day medical examiner office nonbinary 16 year old die suicide family question,"student, death, benedict, nex, charge","36,90,102,100"
18,Supreme Court again refuses to intervene in drag show controversy,1,Supreme Court again refuses to intervene in drag show controversy. It was the second time the court has refused to step into a drag controversy this term.,6,supreme court refuse intervene drag controversy second time court refuse step drag controversy term,"transgender, sport, athlete, court, ban","239,235,81,331"
70,Oprah Winfrey pays tribute at GLAAD Media Awards to gay brother who died from AIDS,2,"Oprah Winfrey pays tribute at GLAAD Media Awards to gay brother who died from AIDS. In an emotional speech during the GLAAD Media Awards in Los Angeles Thursday night, Oprah Winfrey paid a tearful tribute to her late brother, Jeffrey Lee, who died from AIDS in 1989 when he was just 29 years old.",4,oprah winfrey pay tribute glaad media awards brother die aids emotional speech glaad media awards los angeles thursday night oprah winfrey pay tearful tribute late brother jeffrey lee die aids 1989 29 year old,"trump, new, republican, face, drag, health","230,83,59,63"
126,"From contradictions to compassion, the LDS Church struggles with LGBTQ+ inclusion",3,"From contradictions to compassion, the LDS Church struggles with LGBTQ+ inclusion. Despite assertions of immutability and consistency, The Church of Jesus Christ of Latter-day Saints’s positions on sexuality and gender have proven fragile and changeable across time. Throughout much of the 19th century, for example, plural marriage between a…",5,contradiction compassion lds church struggle lgbtq+ inclusion despite assertion immutability consistency church jesus christ day saints position sexuality gender prove fragile changeable time 19th century example plural marriage …,"community, sanctuary, city, transgender, group","229,34,154,175"
147,"Editor Q&A: Florida can 'say gay,' and what motivates LGBTQ+ voters",4,"Editor Q&A: Florida can 'say gay,' and what motivates LGBTQ+ voters. It was a busy week in LGBTQ+ news, and two Advocate editors sat down for a conversation about the latest headlines on Advocate Today. Up for discussion: a settlement on the ‘don't say gay’ bill in Florida, and a new poll that found restrictions on trans and a…",2,editor q&a florida motivate lgbtq+ voter busy week lgbtq+ news advocate editor sit conversation late headline advocate today discussion settlement bill florida new poll find restriction tran …,"bill, anti, ban, marriage, new, law","251,167,152,151"
215,"Elliot Page on LGBTQ cinema: ‘I’m sorry, but this is not niche’",5,"Elliot Page on LGBTQ cinema: ‘I’m sorry, but this is not niche’. Speaking at the BFI Flare, London’s LGBTQ film festival, Elliot Page, whose new film is ""Close to You,"" took aim at the notion that queer films only have a small audience.",3,elliot page cinema sorry niche speak bfi flare london film festival elliot page new film close aim notion film small audience,"new, star, film, actor, audience, love","7,20,366,22"
148,LGBTQ+ TikTokers: Banning app will 'eliminate' online communities & activism (exclusive),6,"LGBTQ+ TikTokers: Banning app will 'eliminate' online communities & activism (exclusive). The U.S. House of Representatives has voted to ban TikTok
, jeopardizing the LGBTQ+ users who have built communities on the platform, as well as the queer content creators whose livelihood depends on it.",2,lgbtq+ tiktoker ban app eliminate online community activism exclusive u.s. house representatives vote ban tiktok jeopardize lgbtq+ user build community platform content creator livelihood depend,"bill, anti, ban, marriage, new, law","251,167,152,151"
216,"Oprah, Niecy Nash, Out win big at GLAAD awards",7,"Oprah, Niecy Nash, Out win big at GLAAD awards. The 35th GLAAD Media Awards were handed out Thursday evening in Beverly Hills, Calif., with Out — a sister publication of The Advocate — winning the 2024 GLAAD Media Award for Outstanding Magazine Overall Coverage.",3,oprah niecy nash win big glaad award 35th glaad media awards hand thursday evening beverly hills calif. — sister publication advocate — win 2024 glaad media award outstanding magazine overall coverage,"new, star, film, actor, audience, love","7,20,366,22"
71,Republican Ohio senate candidate Bernie Moreno’s LGBTQ+ hypocrisy exposed,8,"Republican Ohio senate candidate Bernie Moreno’s LGBTQ+ hypocrisy exposed. Prominent Republican Ohio U.S. Senate candidate Bernie Moreno, once lauded for his advocacy and support within the LGBTQ+ community, now faces scrutiny over his current hardline conservative political positions and a past linked to an adult website profile.",4,republican ohio senate candidate bernie moreno lgbtq+ hypocrisy expose prominent republican ohio u.s. senate candidate bernie moreno laud advocacy support lgbtq+ community face scrutiny current hardline conservative political position past link adult website profile,"trump, new, republican, face, drag, health","230,83,59,63"
267,"Yes, J.K. Rowling, the Nazis persecuted trans people, burned books",9,"Yes, J.K. Rowling, the Nazis persecuted trans people, burned books. J.K. Rowling, well known for her anti-transgender stances, recently questioned a social media post that said Germany’s Nazi regime burned books on trans health care, suggesting it might be a “fever dream” and that the poster should do some fact-checking. Well…",8,yes j.k. rowling nazis persecute trans burn book j.k. rowling know anti transgender stance recently question social media post germany nazi regime burn book tran health care suggest fever dream poster fact checking …,"russia, right, face, hate, man, new","260,101,44,252"
1,"Toxicology experts say death from medications in Nex Benedict case ‘very, very uncommon’",10,"Toxicology experts say death from medications in Nex Benedict case ‘very, very uncommon’. The death of Nex Benedict, a 16-year-old transgender student of Indigenous heritage from Oklahoma who used he, him, they, and them pronouns, has ignited a nationwide debate on several issues, including the rampant bullying faced by LGBTQ+ students in schools …",0,toxicology expert death medication nex benedict case uncommon death nex benedict 16 year old transgender student indigenous heritage oklahoma use pronoun ignite nationwide debate issue include rampant bullying face lgbtq+ student school …,"student, death, benedict, nex, charge","36,90,102,100"
149,LGBTQ+ in Africa: How the US far-right whips up homophobia,11,"LGBTQ+ in Africa: How the US far-right whips up homophobia. Tough laws targeting homosexual acts or abortion in African nations are often preceded by the lobbying of American hardliners. Often well-financed, they campaign against equality and diversity.",2,lgbtq+ africa far right whip homophobia tough law target homosexual act abortion african nation precede lobbying american hardliner finance campaign equality diversity,"bill, anti, ban, marriage, new, law","251,167,152,151"
72,Gov. Ron DeSantis' war on 'woke' appears to be losing steam in Florida,12,"Gov. Ron DeSantis' war on 'woke' appears to be losing steam in Florida. A federal court recently blocked most of a key DeSantis measure, the Stop WOKE Act. Courts have ruled against a number of the governor's conservative initiatives.",4,gov. ron desantis war woke appear lose steam florida federal court recently block key desantis measure stop woke act court rule number governor conservative initiative,"trump, new, republican, face, drag, health","230,83,59,63"
19,College swimmers and volleyball players sue NCAA over transgender policies,13,"College swimmers and volleyball players sue NCAA over transgender policies. Riley Gaines was among the college athletes who filed a lawsuit against the NCAA, accusing it of violating Title IX rights by allowing transgender swimmer Lia Thomas to compete.",6,college swimmer volleyball player sue ncaa transgender policy riley gaines college athlete file lawsuit ncaa accuse violate title ix right allow transgender swimmer lia thomas compete,"transgender, sport, athlete, court, ban","239,235,81,331"
150,Things to know about developments impacting LGBTQ+ rights across the US,14,Things to know about developments impacting LGBTQ+ rights across the US. The rights of LGBTQ+ people continue to be in flux across the U.S. with a new flurry of developments,2,thing know development impact lgbtq+ right right lgbtq+ continue flux u.s. new flurry development,"bill, anti, ban, marriage, new, law","251,167,152,151"
20,Riley Gaines among athletes suing NCAA over transgender policies,15,Riley Gaines among athletes suing NCAA over transgender policies. The NCAA is accused of violating Title IX by allowing transgender athlete Lia Thomas to compete at the national championships in 2022.,6,riley gaines athlete sue ncaa transgender policy ncaa accuse violate title ix allow transgender athlete lia thomas compete national championship 2022,"transgender, sport, athlete, court, ban","239,235,81,331"
217,'Love Lies Bleeding' is the queer erotic thriller Kristen Stewart fans have wanted,16,"'Love Lies Bleeding' is the queer erotic thriller Kristen Stewart fans have wanted. The movie Love Lies Bleeding is a fun and weird erotic thriller. It's set in the late 1980s and stars Kristen Stewart as a brooding gym manager who falls in love with a hitchhiking bodybuilder, played by Katy O'Brian. Directed by Rose Glass (Saint Maud), the …",3,love lie bleeding erotic thriller kristen stewart fan want movie love lies bleeding fun weird erotic thriller set late 1980 star kristen stewart brood gym manager fall love hitchhike bodybuilder play katy o'brian direct rose glass saint maud …,"new, star, film, actor, audience, love","7,20,366,22"
21,Riley Gaines: 'It's Time We Fight Back' Against NCAA's Trans Agenda,17,Riley Gaines: 'It's Time We Fight Back' Against NCAA's Trans Agenda. Women's sports advocate Riley Gaines has joined 15 other female athletes in a lawsuit against the NCAA over its transgender agenda.,6,riley gaines time fight ncaa trans agenda women sport advocate riley gaines join 15 female athlete lawsuit ncaa transgender agenda,"transgender, sport, athlete, court, ban","239,235,81,331"
2,"Former students, parents speak on anti-LGBTQ bullying at Nex Benedict's school",18,"Former students, parents speak on anti-LGBTQ bullying at Nex Benedict's school. Nex Benedict's death has been ruled a suicide, shining a renewed spotlight on the intensifying environment in Oklahoma schools and anti-LGBTQ bullying.",0,student parent speak anti bullying nex benedict school nex benedict death rule suicide shine renew spotlight intensifying environment oklahoma school anti bullying,"student, death, benedict, nex, charge","36,90,102,100"
22,More than a dozen athletes sue NCAA over their transgender participation policy,19,More than a dozen athletes sue NCAA over their transgender participation policy. The lawsuit stems from an NCAA policy that allows transgender athletes to compete in the category of their affirmed gender on a sport-by-sport basis.,6,dozen athlete sue ncaa transgender participation policy lawsuit stem ncaa policy allow transgender athlete compete category affirm gender sport sport basis,"transgender, sport, athlete, court, ban","239,235,81,331"
218,Check out the lesbian wedding at the center of 'Anyone But You',20,Check out the lesbian wedding at the center of 'Anyone But You'. The romcom Anyone But You stars Sydney Sweeney and Glenn Powell as star-crossed loves who initially can’t stand each other a la Much Ado About Nothing. But a lesbian wedding Down Under is the central event around which Sweeney’s Bea and Powell’s Ben orbit. Qu…,3,check lesbian wedding center romcom star sydney sweeney glenn powell star cross love initially stand la ado lesbian wedding central event sweeney bea powell ben orbit qu …,"new, star, film, actor, audience, love","7,20,366,22"
316,Hungary’s PM urges supporters to ‘occupy Brussels’,21,"Hungary’s PM urges supporters to ‘occupy Brussels’. The EU leadership should “start trembling,” Hungary’s aggrieved Prime Minister Viktor Orban tells crowd at event commemorating revolution Read Full Article at RT.com",1,hungary pm urge supporter occupy brussels eu leadership start tremble hungary aggrieve prime minister viktor orban tell crowd event commemorate revolution rt.com,"eurovision, boycott, growth, gaza, israel, song","192,172,274,21"
219,Elliot Page: LGBTQQIAAP2S+-Themed Films Are Not 'Niche' Because 30% of Youth Identify as LGBTQQIAAP2S+,22,Elliot Page: LGBTQQIAAP2S+-Themed Films Are Not 'Niche' Because 30% of Youth Identify as LGBTQQIAAP2S+. Transgender actor Elliot Page is blasting Hollywood producers who feel that queer films are not movies for a mainstream audience.,3,elliot page lgbtqqiaap2s+-themed films niche 30 youth identify lgbtqqiaap2s+ transgender actor elliot page blast hollywood producer feel film movie mainstream audience,"new, star, film, actor, audience, love","7,20,366,22"
220,Inside one of London's LGBTQ-friendly fitness classes,23,Inside one of London's LGBTQ-friendly fitness classes. Ryan Lanji runs sessions for people in the LGBT community who feel marginalised by mainstream gyms.,3,inside london friendly fitness class ryan lanji run session community feel marginalise mainstream gym,"new, star, film, actor, audience, love","7,20,366,22"
221,Arizona Bookstore Nixes ‘Drag Show for Palestine’ Event After Backlash: ‘They Should Do This in Palestine’,24,"Arizona Bookstore Nixes ‘Drag Show for Palestine’ Event After Backlash: ‘They Should Do This in Palestine’. A bilingual Arizona bookstore canceled its family-friendly “Drag Show for Palestine” following backlash over the planned performance, with critics noting that drag shows — as well as any sort of LGBTQ expression — are strictly prohibited in Palestinian-contro…",3,arizona bookstore nixes drag palestine event backlash palestine bilingual arizona bookstore cancel family friendly drag palestine follow backlash plan performance critic note drag — sort expression — strictly prohibit palestinian contro …,"new, star, film, actor, audience, love","7,20,366,22"
3,Missing University of Missouri student Riley Strain's bank card discovered as search continues,25,"Missing University of Missouri student Riley Strain's bank card discovered as search continues. Authorities discovered a clue in the case of missing University of Missouri college student Riley Strain, Sunday, who vanished while visiting Nashville...",0,missing university missouri student riley strain bank card discover search continue authority discover clue case miss university missouri college student riley strain sunday vanish visit nashville ...,"student, death, benedict, nex, charge","36,90,102,100"
268,"The bomb scare, the police and the drag queen",26,"The bomb scare, the police and the drag queen. How a picture of a drag queen on a police Land Rover came to represent Northern Ireland's gay community.",8,bomb scare police drag queen picture drag queen police land rover come represent northern ireland community,"russia, right, face, hate, man, new","260,101,44,252"
23,This women’s roller derby league is standing up for trans athletes by suing their county,27,This women’s roller derby league is standing up for trans athletes by suing their county. A women's roller derby league in New York is suing their county over an ordinance that bans female sports teams with transgender athletes from using local facilities.,6,roller derby league stand tran athlete sue county roller derby league new york sue county ordinance ban female sport team transgender athlete use local facility,"transgender, sport, athlete, court, ban","239,235,81,331"
127,Colorado May Become First in Nation to Build Segregated Prison Cells for Transgender Inmates,28,Colorado May Become First in Nation to Build Segregated Prison Cells for Transgender Inmates. The state of Colorado may soon have to accommodate transgender women in prison due to a lawsuit filed in 2019.,5,colorado nation build segregated prison cells transgender inmates state colorado soon accommodate transgend prison lawsuit file 2019,"community, sanctuary, city, transgender, group","229,34,154,175"
73,The Sydney sheikh on a mission to keep young Australian Muslims in the faith,29,The Sydney sheikh on a mission to keep young Australian Muslims in the faith. Sheikh Shadi Asuleiman is Australia's first home-grown Imam and the changing face of Islam here.,4,sydney sheikh mission young australian muslims faith sheikh shadi asuleiman australia home grow imam change face islam,"trump, new, republican, face, drag, health","230,83,59,63"
74,Kingston's storied Grad Club facing closure as Queen's hikes rent,30,Kingston's storied Grad Club facing closure as Queen's hikes rent. It hosted some of The Tragically Hip's earliest concerts and has been a gathering place for Kingston's LGBTQ community. But now the Grad Club says it's facing a more than 300 per cent rent increase that could force its closure.,4,kingston story grad club face closure queen hike rent host tragically hip early concert gather place kingston community grad club face 300 cent rent increase force closure,"trump, new, republican, face, drag, health","230,83,59,63"
75,"Transcript: Reps. Raja Krishnamoorthi and Mike Gallagher on ""Face the Nation,"" March 17, 2024",31,"Transcript: Reps. Raja Krishnamoorthi and Mike Gallagher on ""Face the Nation,"" March 17, 2024. The following is a transcript of an interview with Reps. Raja Krishnamoorthi, Democrat of Illinois, and Mike Gallagher, Republican of Wisconsin, that aired on March 17, 2024.",4,transcript reps raja krishnamoorthi mike gallagher face nation march 17 2024 follow transcript interview reps raja krishnamoorthi democrat illinois mike gallagher republican wisconsin air march 17 2024,"trump, new, republican, face, drag, health","230,83,59,63"
222,Best Of: Jenny Slate / Julio Torres,32,"Best Of: Jenny Slate / Julio Torres. Jenny Slate talks about childbirth and motherhood, the subjects of her new comedy special, Seasoned Professional. She'll do the voices of some of her animated characters, including Marcel from her Oscar-nominated film Marcel the Shell with Shoes On.Also, we h…",3,jenny slate julio torres jenny slate talk childbirth motherhood subject new comedy special seasoned professional voice animate character include marcel oscar nominate film marcel shell shoes h …,"new, star, film, actor, audience, love","7,20,366,22"
269,"Trans content creators say social media can be toxic, but won't let hate push them offline",33,"Trans content creators say social media can be toxic, but won't let hate push them offline. Fae Johnstone and Lauren Sundstrom have large social media followings which also attract a lot of hate. But they are adamant that they won't be forced into the social media shadows by what they say are transphobic commenters and trolls.",8,tran content creator social medium toxic let hate push offline fae johnstone lauren sundstrom large social medium following attract lot hate adamant force social medium shadow transphobic commenter troll,"russia, right, face, hate, man, new","260,101,44,252"
128,Gallup poll: The number of American adults identifying as LGBTQ+ has more than doubled in the last 12 years,34,"Gallup poll: The number of American adults identifying as LGBTQ+ has more than doubled in the last 12 years. A recent annual survey by Gallup reveals that the number of Americans who identify as members of the LGBTQ+ community has doubled since 2012, with nearly 30 percent of Gez Z women identifying as not heterosexual. The survey was conducted on more than 12,000 A…",5,"gallup poll number american adult identify lgbtq+ double 12 year recent annual survey gallup reveal number americans identify member lgbtq+ community double 2012 nearly 30 percent gez z identify heterosexual survey conduct 12,000 …","community, sanctuary, city, transgender, group","229,34,154,175"
151,EU candidate plans ‘LGBT propaganda’ bill,35,"EU candidate plans ‘LGBT propaganda’ bill. Georgia needs to ban “LGBT propaganda,” the country’s top MP has said Read Full Article at RT.com",2,eu candidate plan propaganda bill georgia need ban propaganda country mp rt.com,"bill, anti, ban, marriage, new, law","251,167,152,151"
4,New video shows college student briefly speak with police on night he vanished,36,New video shows college student briefly speak with police on night he vanished. Newly released video shows missing college student Riley Strain briefly speak with a police officer on the night he vanished in Nashville.,0,new video college student briefly speak police night vanish newly release video miss college student riley strain briefly speak police officer night vanish nashville,"student, death, benedict, nex, charge","36,90,102,100"
24,"GOP lawmakers call for Alabama space camp employee to be fired, simply for being transgender",37,"GOP lawmakers call for Alabama space camp employee to be fired, simply for being transgender. An Alabama resident sparked a transphobic backlash against an employee at the U.S. Space and Rocket Center's Space Camp in Huntsville, leading to calls for the employee to be fired because she is transgender.",6,gop lawmaker alabama space camp employee fire simply transgend alabama resident spark transphobic backlash employee u.s. space rocket center space camp huntsville lead employee fire transgender,"transgender, sport, athlete, court, ban","239,235,81,331"
223,"'Will & Grace' star says roles should go to best actors, irrespective of sexuality",38,"'Will & Grace' star says roles should go to best actors, irrespective of sexuality. Eric McCormack weighs in on the debate about whether non-LGBTQ actors should be able to play gay.",3,grace star role good actor irrespective sexuality eric mccormack weigh debate non actor able play,"new, star, film, actor, audience, love","7,20,366,22"
270,Chasten Buttigieg takes on anti-trans bullies during Michigan State University lecture,39,"Chasten Buttigieg takes on anti-trans bullies during Michigan State University lecture. Chasten Buttigieg is not backing down as he continues to call attention to the anti-LGBTQ+ atmosphere of bullying that contributed to the death of Oklahoma teen Nex Benedict. In an evocative lecture at Michigan State University’s Department of Theatre, Buttig…",8,chasten buttigieg anti trans bully michigan state university lecture chasten buttigieg continue attention anti lgbtq+ atmosphere bullying contribute death oklahoma teen nex benedict evocative lecture michigan state university department theatre buttig …,"russia, right, face, hate, man, new","260,101,44,252"
152,California parents oust school board members who enacted anti-LGBTQ+ policy,40,California parents oust school board members who enacted anti-LGBTQ+ policy. Parents in Southern California have voted to remove two conservative school board members after they spearheaded a policy that forcibly outs transgender students to their guardians.,2,california parent oust school board member enact anti lgbtq+ policy parent southern california vote remove conservative school board member spearhead policy forcibly transgend student guardian,"bill, anti, ban, marriage, new, law","251,167,152,151"
25,Former Olympian Caitlyn Jenner backs New York county's ban on transgender female athletes,41,Former Olympian Caitlyn Jenner backs New York county's ban on transgender female athletes. Former Olympic gold medalist Caitlyn Jenner on Monday said she supported a local New York official’s order banning female sports teams with transgender...,6,olympian caitlyn jenner new york county ban transgender female athlete olympic gold medalist caitlyn jenner monday support local new york official order ban female sport team transgender ...,"transgender, sport, athlete, court, ban","239,235,81,331"
153,Kentucky lawmakers seek to criminalize 'disruptive conduct' after LGBTQ+ protest,42,"Kentucky lawmakers seek to criminalize 'disruptive conduct' after LGBTQ+ protest. After 19 protesters were arrested when the legislature passed a sweeping anti-LGBTQ+ bill, lawmakers are considering new punishments — which civil rights activists say could limit free speech.",2,kentucky lawmaker seek criminalize disruptive conduct lgbtq+ protest 19 protester arrest legislature pass sweeping anti lgbtq+ bill lawmaker consider new punishment — civil right activist limit free speech,"bill, anti, ban, marriage, new, law","251,167,152,151"
26,Idaho considers a ban on using public funds or facilities for transgender care,43,"Idaho considers a ban on using public funds or facilities for transgender care. Idaho lawmakers are expected to vote this week on a bill that would ban the use of any public funds for gender-affirming care, including for state employees using work health insurance and for adults covered by Medicaid.",6,idaho consider ban use public fund facility transgender care idaho lawmaker expect vote week bill ban use public fund gender affirm care include state employee use work health insurance adult cover medicaid,"transgender, sport, athlete, court, ban","239,235,81,331"
